name,id,updated,level,C1_School closing,notes_C1,C2_Workplace closing,notes_C2,C3_Cancel public events,notes_C3,C4_Restrictions on gatherings,notes_C4,C5_Close public transport,notes_C5,C6_Stay at home requirements,notes_C6,C7_Restrictions on internal movement,notes_C7,C8_International travel controls,notes_C8,E1_Income support,notes_E1,E2_Debt/contract relief,notes_E2,H1_Public information campaigns,notes_H1,H2_Testing policy,notes_H2,H3_Contact tracing,notes_H3,H6_Facial Coverings,notes_H6,H7_Vaccination policy,notes_H7
United States,USA,Tue 02 Feb 2021,0,3,Some states like District of Columbia still have full closure in effect.  http://web.archive.org/web/20210202004334/https://www.edweek.org/leadership/map-where-are-schools-closed/2020/07,2,Some sectors are still closed in states such as Michigan where nightclubs and waterparks are closed.  State by State Restrictions - http://web.archive.org/web/20210202004853/https://www.aarp.org/politics-society/government-elections/info-2020/coronavirus-state-restrictions.html    Michigan - http://web.archive.org/web/20210202004446/https://www.michigan.gov/coronavirus/  ,2,State by State Restrictions - http://web.archive.org/web/20210202004853/https://www.aarp.org/politics-society/government-elections/info-2020/coronavirus-state-restrictions.html ,4,Some states such as Ohio restrict gatherings to 10 people or less  State by State Restrictions - http://web.archive.org/web/20210202004853/https://www.aarp.org/politics-society/government-elections/info-2020/coronavirus-state-restrictions.html  ,1,"There is no evidence that Public transport is back to operating at full capacity in any state. Wearing masks, social distancing (at least 6 feet) and skipping a row of seats if possible  is encouraged by CDC in the guidelines.  CDC guidelines  - http://web.archive.org/web/20210118211252/https://www.cdc.gov/coronavirus/2019-ncov/daily-life-coping/using-transportation.html   State by State restrictions - http://web.archive.org/web/20210118182002/https://www.aarp.org/politics-society/government-elections/info-2020/coronavirus-state-restrictions.html   ",2,Some states such as Ohio have a curfew in place   State by State Restrictions - http://web.archive.org/web/20210202004853/https://www.aarp.org/politics-society/government-elections/info-2020/coronavirus-state-restrictions.html,2,See State Travel Restrictions - http://web.archive.org/web/20210202010507/https://www.nytimes.com/2020/07/10/travel/state-travel-restrictions.html ,3,"The United States has restricted the entry of all foreign nationals who have passed through or have been in China, Iran, Most European Countries, UK, Ireland, Brazil and South Africa in the past 14 days. Starting on January 26, all travelers (including US citizens and transit passenger) must present a negative COVID-19 viral or antigen test result issued 72 hours prior to departure or have an evidence of having contracted and recovered from COVID-19 prior to boarding the plane.  http://web.archive.org/web/20210131133052/https://www.kayak.com/travel-restrictions    http://web.archive.org/web/20210202011147/https://www.cdc.gov/coronavirus/2019-ncov/travelers/testing-international-air-travelers.html",2,Implementation has begun for the continued Unemployment benefits has begun.  http://web.archive.org/web/20210115201910/https://edition.cnn.com/2021/01/14/politics/300-unemployment-benefit-congress/index.html   http://web.archive.org/web/20210118225114/https://www.cnbc.com/2021/01/05/these-states-are-already-paying-out-the-new-300-unemployment-boost.html  ,1,President Biden signed executive orders on 22nd January 2021. Details and Date order goes into effect are unknown.  Executive Order on Economic Relief Related to the COVID-19 Pandemic - http://web.archive.org/web/20210126101047/https://www.whitehouse.gov/briefing-room/statements-releases/2021/01/22/talking-points-january-22-executive-orders-economic-relief/     American Rescue Plan - http://web.archive.org/web/20210126101632/https://www.whitehouse.gov/briefing-room/speeches-remarks/2021/01/22/remarks-by-president-biden-on-the-american-rescue-plan-and-signing-of-executive-orders/   ,2,Coordinated public campaign by the CDC and the State Public Health Departments.  https://archive.st/archive/2021/1/www.cdc.gov/o2om/www.cdc.gov/coronavirus/2019-ncov/index.html  ,3,States like Illinois have Community-Based Testing Sites which are open to all regardless of symptoms. - http://web.archive.org/web/20210112014921/https://www.dph.illinois.gov/testing   Number of Covid tests - http://web.archive.org/web/20210112014305/https://www.statista.com/statistics/1028731/covid19-tests-select-countries-worldwide/   Rate of covid tests - http://web.archive.org/web/20210112014827/https://www.statista.com/statistics/1104645/covid19-testing-rate-select-countries-worldwide/   ,2,MIT Technology Review has put together a list to track the contact tracing apps. - http://web.archive.org/web/20201230151537/https://www.health-house.be/en/corona/mit-technology-review-covid-tracing-tracker/   MIT Technology Review Database - List of US states Contact tracing apps and Penetration rate - https://archive.vn/2656C   ,4,"States like Maine still require mandatory face coverings  statewide for anyone 5 and older in public spaces, even if social distancing can be maintained.   http://web.archive.org/web/20210126005148/https://www.aarp.org/politics-society/government-elections/info-2020/coronavirus-state-restrictions.html     One of President Biden’s first actions in office was to issue new orders requiring mask-wearing on planes, in airports and on all federal property.   http://web.archive.org/web/20210126092323/https://www.washingtonpost.com/transportation/2021/01/22/coronavirus-biden-mask-mandate/  ",1,A  Doses are for Pfizer-BioNTech vaccine and Moderna Vaccine  http://web.archive.org/web/20210126094117/https://covid.cdc.gov/covid-data-tracker/#vaccinations   
Alaska,AK,Tue 02 Feb 2021,1,2,"No detected change.    Of the three largest school districts in Alaska, Mat-Su school district continues to deliver teaching in-person, with no school closures detailed on their website. However, Anchorage school district and Fairbanks North Star school district continue to deliver teaching remotely. Both districts still have plans in place to re-open for in-person teaching tomorrow, 19 January.    Fairbanks North Star SD website:  https://web.archive.org/web/20210118201719/https://www.k12northstar.org/Page/10620    Mat-Su SD website:  https://web.archive.org/web/20210118201808/https://www.matsuk12.us/coronavirus    Anchorage SD website:  https://web.archive.org/web/20210118201855/https://www.asdk12.org/Page/16303    No evidence found for further opening and delivery of teaching at Alaska's universities and colleges, including the largest university system, the University of Alaska (Anchorage, Fairbanks, Southeast).",1,"EO-17 remains in effect in Anchorage.    - The hospitality industry (bars, restaurants, etc.) may open with up to 25% maximum building occupancy indoors.  - The bingo halls, theaters and other entertainment facilities may open with up to 25% maximum building occupancy indoors.  - Indoor gyms, recreation and fitness centres may open with up to 50% maximum building occupancy indoors.  - Salons and personal care service providers may open with up to 50% maximum building occupancy indoors.  - Retail stores and all other public-facing businesses not mentioned above are limited to 50% of maximum building occupancy.    Employers must require employees to work from home when their work can be accomplished remotely without significantly impeding business operations.    EO-17:  https://web.archive.org/web/20210117204214/https://www.muni.org/covid-19/documents/eo%2017%20final.pdf",2,"On February 1, 2021, The Mayor of Anchorage implemented EO -18 ""Easing Up"", which eases up restrictions on some of the economy's hardest-hit sectors while keeping certain limits in place to prevent the virus from returning to extremely high-risk levels. It will remain in place until revoked. Entertainment facilities may operate at up to 50% capacity. All indoor gatherings involving consumption of food or drink are limited to 10 people.  • All indoor gatherings without food or drink are limited to 15 people.  • All outdoor gatherings involving consumption of food or drink are limited to 30 people.  • All outdoor organized gatherings without food or drink are limited to 50 people    https://web.archive.org/web/20210201222235/http://www.muni.org/Departments/Mayor/PressReleases/Pages/Acting-Mayor-Issues-Emergency-Order-EO-18-Easing-Up.aspx",3,"On February 1, 2021, The Acting Mayor of Anchorage implemented EO -18 ""Easing Up"", which eases up restrictions that were in place from EO-17. EO-18 will remain in place until revoked.   • All indoor gatherings involving consumption of food or drink are limited to 10 people.  • All indoor gatherings without food or drink are limited to 15 people.  • All outdoor gatherings involving consumption of food or drink are limited to 30 people.  • All outdoor organized gatherings without food or drink are limited to 50 people    https://web.archive.org/web/20210201222235/http://www.muni.org/Departments/Mayor/PressReleases/Pages/Acting-Mayor-Issues-Emergency-Order-EO-18-Easing-Up.aspx",0,"No change detected after searching news articles, press releases and executive orders.",1,"EO-17 remains in effect in Anchorage.    Everyone in the Municipality of Anchorage (the ""Municipality"") shall limit outings and physical contact with those outside of their household. On the occasions when individuals leave home, they shall maintain physical distancing of at least six feet from any person outside their household whenever possible.    EO-17:  https://web.archive.org/web/20210117204214/https://www.muni.org/covid-19/documents/eo%2017%20final.pdf",2,"Alaska Governor Mike Dunleavy issued a Public Health Disaster Emergency Declaration effective 12:00am, January 15, 2021, until 12:00am February 14, 2021, due to the continuation of the COVID-19 virus in the State of Alaska. Under this declaration, Outbreak Health Orders 6 and 8 were reissued.    Restrictions for intrastate travel are as follows:    All travel from a community on the Road System or the Alaska Marine Highway System:  a. Less than or equal to 72 hours – If the traveler is in a community on the Road  System or the Alaska Marine Highway System for less than or equal to 72 hours:  i. Recommend testing for SARS-CoV-2 using a molecular test 5 days after arrival at final destination.  ii. Follow strict social distancing until negative test results are received.  iii. If the traveler does not get a molecular test for SARS-CoV-2, they must follow strict social distancing for 14 days at final destination.    b. Greater than 72 hours – If the traveler is in a community on the Road System or the Alaska Marine Highway System for greater than 72 hours:  i. Get a molecular test for SARS-CoV-2 within 72 hours prior to travel to a community off the Road System or the Alaska Marine Highway System.  ii. The traveler should not commence travel until a negative test result is received.  iii. If return travel cannot be delayed until the test result is available, the traveler must follow strict social distancing until they receive a negative result.  iv. Five days after arrival at final destination, recommend testing for SARS-CoV-2 using a molecular test, and follow strict social distancing until negative test results are received.  v. If the traveler does not get a molecular test for SARS-CoV-2, they must follow strict social distancing for 14 days at their final destination.      All international and interstate travelers:  a) Must complete a Travel Declaration Form and a Self-Isolation Plan in the Alaska Travel Portal.  b) Any person currently positive with COVID-19 cannot travel to Alaska until they have been released from isolation, or cleared for travel, by a medical provider or public health agency.      Outbreak Health Order 6:  https://web.archive.org/web/20210118200525/https://covid19.alaska.gov/wp-content/uploads/2021/01/01.15.21-Outbreak-Health-Order-No-6-International-and-Interstate-Travel-DD4.pdf    Outbreak Health Order 8:  https://web.archive.org/web/20210118201150/https://covid19.alaska.gov/wp-content/uploads/2021/01/01.15.21-Outbreak-Health-Order-No-8-Intrastate-Travel-DD4.pdf",3,"Travelers from the UK now required to have a negative pre-departure COVID-19 test to enter the US, in addition to existing travel bans for flights coming from other countries.     See the order from the CDC:  http://web.archive.org/web/20201229024000/https://www.cdc.gov/quarantine/pdf/UK-Airline-Testing-Order_CLEAN-R3-signed-12252020-encrypted.pdf  ",1,"As of 17 January 2021, no change has been detected. Alaska's COVID-19 Economic Stabilization Plan remains in place.    https://web.archive.org/web/20210117204547/https://gov.alaska.gov/home/covid-19-economic-plan/",1,Eviction moratorium extended another month with the COVID-19 package signed by President Trump on 27 December.    See CBS News Article:  http://web.archive.org/web/20210103154327/https://www.cbsnews.com/news/eviction-moratorium-us-renters-face-housing-court-legal-battles-without-lawyers-covid-pandemic/,2,No change detected - Alaska's COVID-19 website remains live.    https://web.archive.org/web/20210117194437/https://covid19.alaska.gov/,3,"No change detected after searching news articles, press releases and executive orders.",1,"According to Covid Act Now, contact tracing remains strained in Alaska due to a lack of contact tracers hired to trace each new case to a known case within 48 hours of detection.    Continuing to code as 1.    https://web.archive.org/web/20210117194151/https://covidactnow.org/us/alaska-ak/?s=1522471",3,"EO-13 remains in effect in Anchorage - masks are required to be worn in indoor public settings and communal spaces, in addition to outdoor gatherings where social distancing is not possible.    EO-13:  https://web.archive.org/web/20210110174326/https://www.muni.org/covid-19/documents/eo-13v3.pdf",2,"Coding as 2 - A, C:    As of 18 January 2021, the following groups are eligible for vaccination. Both the Moderna and Pfizer vaccinations are currently being adminstered.    - Long term care facility staff and residents  - Hospital-based frontline health care workers and hospital personnel who are frequently exposed to COVID-19 patients  - Frontline EMS and Fire Service personnel providing medical services, who are frequently exposed to COVID-19 patients  - Community Health Aides/Practitioners  - Health care workers providing vaccinations to identified populations in Phase 1a  - Individuals aged 65 years and older    Workers in health care settings who meet all of the following criteria:  - Have direct human patient contact, or have direct contact with infectious materials from patients, AND  - Provide essential services in a hospital, clinic, home, or community-based setting that cannot be offered remotely or performed via telework; AND  - Provide essential health care service in a health care setting that cannot be postponed without serious negative impact to the patient's health    DHSS vaccine eligibility page:  https://web.archive.org/web/20210118203230/http://dhss.alaska.gov/dph/Epi/id/Pages/COVID-19/VaccineAvailability.aspx"
Alabama,AL,Tue 02 Feb 2021,1,2,"School closures appear to remain a district-by-district decision in Alabama. On 14 January, Birmingham City Schools decided to continue with full remote learning. The day of the announcement, the district hosted a live training session to teach parents how to use school-related software.     See coverage from local TV station, 6WBRC, here: http://web.archive.org/web/20210118210649/https://www.wbrc.com/2021/01/14/birmingham-city-schools-offers-virtual-learning-help-students/",1,"The Extended Safer at Home Order remains in effect from December 9, 2020 to January 22, 2021 at 5:00 p.m.    (Workplaces can remain open as long as they follow guidance and safety protocols set out in the proclamation)    Twentieth Supplemental Proclamation:  https://web.archive.org/web/20201228200502/https://governor.alabama.gov/assets/2020/12/2020-12-09-20th-Supplemental-SOE-COVID-19.pdf    Extended Safer at Home Order:  https://web.archive.org/web/20201221044800/https://governor.alabama.gov/assets/2020/12/Safer-at-Home-Order-Final-12.9.2020.pdf  ",1,"The CDC states, ""The size of an event or gathering should be determined based on state, local, territorial or tribal safety laws and regulations"" and that the department only supplements considerations for public and private gatherings.     Link:  https://web.archive.org/web/20210129144317/https://www.cdc.gov/coronavirus/2019-ncov/community/large-events/considerations-for-events-gatherings.html",0,"While there are not any restrictions on the number of individuals who can gather statewide, Governor Kay's 9 December 'Safer at Home' order does prohibit non-work gatherings where individuals from different households cannot social distance.     Full text of the order: https://web.archive.org/web/20201228200502/https://governor.alabama.gov/assets/2020/12/2020-12-09-20th-Supplemental-SOE-COVID-19.pdf",1,"MAXTransit, in Birmingham, continues to close seats in response to COVID-19.    See their webpage and COVID-19 updates here: http://web.archive.org/web/20210201223644/https://maxtransit.org/",1,18 December: A pinned post on Governor Kay Ivey's official Facebook page recommends staying at home until 22 January 2021.    Post: http://web.archive.org/web/20210118212638/https://www.facebook.com/KayIveyAL/photos/pcb.3531696883595616/3531695983595706/,1,The CDC continues to recommend postponing travel and to stay home as the best way to protect an individual and others from contracting COVID-19.    Link:  https://web.archive.org/web/20210124174107/https://www.cdc.gov/coronavirus/2019-ncov/travelers/travel-during-covid19.html,3,"The White House Presidential Action ""Proclamation on the Suspension of Entry as Immigrants and Non-Immigrants of Certain Additional Persons Who Pose a Risk of Transmitting Coronavirus Disease"" goes into effect January 26th expanding the list of foreign nationals prohibited from entering the US. With specific exemptions, non-nationals from the Schengen Area, the United Kingdom (excluding overseas territories outside of Europe), the Republic of Ireland, Brazil, and South Africa are not allowed entry into the US . Travelers from Iran and China are not allowed entry unless they fall under specific expemtions as well.     Links:  https://web.archive.org/web/20210125193014/https://www.whitehouse.gov/briefing-room/presidential-actions/2021/01/25/proclamation-on-the-suspension-of-entry-as-immigrants-and-non-immigrants-of-certain-additional-persons-who-pose-a-risk-of-transmitting-coronavirus-disease/  https://web.archive.org/web/20210130183529/https://www.cdc.gov/coronavirus/2019-ncov/travelers/from-other-countries.html",1,"On 6 January, the Alabama Department of Labor released new guidance on its income support programmes. Due to the new CARES Act, an additional $300 in weekly benefit will be available to claimants. Further conditions are outlined in the press release:     Details on the extensions included in the legislation:    ""Federal Pandemic Unemployment Compensation (FPUC)  • Will provide UP TO 11 weeks of an additional $300 weekly benefit to eligible claimants.  • A claimant must be eligible through a separate unemployment program to receive FPUC.  • FPUC will be available to cover weeks of unemployment between week ending January 3, 2021 and week ending March 13, 2021.    ""Pandemic Unemployment Assistance (PUA)  • Will provide UP TO an additional 11 weeks of benefits, to a maximum of 50 weeks.  • Weekly certification will be required.  • Claimants will be required to provide documentation of eligibility to qualify for PUA beginning Jan. 31, 2021.  • PUA will be available until March 14, 2021 (no new applications after that date), with allowance for three additional weeks of benefits for those who have not reached the maximum number of weeks through week ending April 3, 2021.    ""Pandemic Emergency Unemployment Compensation (PEUC)  • Will provide UP TO an additional 11 weeks of benefits, to a maximum of 24 weeks.  • PEUC will be available until March 14, 2021 (no new applications after that date), with allowance of three additional weeks of benefits for those who have not reached the maximum number of weeks through week ending April 3, 2021.""    Full text of the DOL press release: http://web.archive.org/web/20210111224555/https://labor.alabama.gov/news_feed/News_Page.aspx?id=309",2,"Effective January 31st until March 31st, the CDC Director signed a declaration determining that the evictions of tenants could be detrimental to public health control measures to slow the spread of SARS-Cov-2, the virus that causes COVID-19. Thus there's a temporary halt in residential evictions to prevent the spread of COVID-19.     Links:  https://web.archive.org/web/20210129200707/https://www.cdc.gov/coronavirus/2019-ncov/more/pdf/CDC-Eviction-Moratorium-01292021.pdf",2,"Governor Kay Ivey maintains a robust public presence, including on social media sites such as Facebook. She frequently shares COVID-19 updates with Alabamans through these and other, more traditional channels.    Here is an archived photo from 18 January. It appeared on her Facebook page on 9 December: http://web.archive.org/web/20210118212638/https://www.facebook.com/KayIveyAL/photos/pcb.3531696883595616/3531695983595706/",3,Testing continues to be widely available.,1,"In an undated article, the Alabama Department of Public Health (ADPH) notes that it has 404 employees 'working in the COVID-19 investigative response, including contact tracing'. Contact tracing, the announcement says, is a collaborative endeavour between the state government and universities (such as UAB). The ADPH article is available here: http://web.archive.org/web/20210118214313/https://covid19.alabama.gov/faqs/state-information/department-of-public-health/how-many-employees-are-working-on-contact-tracing-and-death-investigations-related-to-covid-19.     Despite these reassurances, there is no indication that contact tracing is 'comprehensive' or that all potentially exposed individuals receive calls. Thus, the code remains at a 1.",3,"Governor Kay Ivey on Wednesday, December 9, 2020 issued her twentieth supplemental emergency proclamation extending the Safer at Home Order. Individuals will be required to wear a mask or other facial covering when in public and in close contact with other people, as described in the order. This order extends until Friday, January 22, 2021 at 5:00 p.m.    (Workplaces can remain open as long as they follow guidance and safety protocols set out in the proclamation)    https://web.archive.org/web/20201228200502/https://governor.alabama.gov/assets/2020/12/2020-12-09-20th-Supplemental-SOE-COVID-19.pdf  ",3,"On 29 January, Governor Kay Ivey and the Alabama Department of Public Health announced plans to expand vaccine eligibility to those aged 65 and older and additional frontline workers. Those new frontline groups include US Postal Service workers, first responders, corrections workers, grocery store employees and public transit officials. Educators and members of the judiciary were also named as the next priority groups. Vaccines will be available to anyone in one of these categories beginning 8 February.     See the press release here: http://web.archive.org/web/20210201223131/https://governor.alabama.gov/newsroom/2021/01/covid-19-vaccination-eligibility-expanded-in-alabama-to-include-persons-ages-65-through-74-and-others/"
