name,id,updated,level,C1_School closing,flag_C1,notes_C1,C2_Workplace closing,flag_C2,notes_C2,C3_Cancel public events,flag_C3,notes_C3,C4_Restrictions on gatherings,flag_C4,notes_C4,C5_Close public transport,flag_C5,notes_C5,C6_Stay at home requirements,flag_C6,notes_C6,C7_Restrictions on internal movement,flag_C7,notes_C7,C8_International travel controls,flag_C8,notes_C8,E1_Income support,flag_E1,notes_E1,E2_Debt/contract relief,flag_E2,notes_E2,H1_Public information campaigns,flag_H1,notes_H1,H2_Testing policy,flag_H2,notes_H2,H3_Contact tracing,flag_H3,notes_H3,H6_Facial Coverings,flag_H6,notes_H6,H7_Vaccination policy,flag_H7,notes_H7
United States,USA,Wed 23 Jun 2021,0,2,0,"Burbio lists between 1.5% - 3.5% of students attending class fully online, with an additional 20-35% attending hybrid-type classes as of May 24. While a majority of students is attending class in-person, this  almost assuredly remains a 2T. Additionally, as of 07 June 2021, New York City has only partially opened all schools, with full services only fully planned to return with the new school year in September. Other evidence also points to potential school closures in American Samoa, Bureau of Indian Education schools, Montana, and Wyoming.     https://web.archive.org/web/20210607201137/https://info.burbio.com/school-tracker-update-may-24/    https://web.archive.org/web/20210607201125/https://www.npr.org/2021/05/24/999825807/new-york-city-schools-will-fully-reopen-with-no-remote-option-this-fall?t=1623096665316    https://web.archive.org/web/20210607195535/https://www.edweek.org/leadership/map-coronavirus-and-school-closures-in-2019-2020/2020/03",1,0,An executive order issued by Gov. Kevin Stitt on March 12 lifted all statewide restrictions on events and residents. This includes any occupancy restrictions for offices.     https://web.archive.org/web/20210607215752/https://www.northstarmeetingsgroup.com/News/Industry/Coronavirus-states-cities-reopening-COVID-19-new-cases#Oklahoma    https://web.archive.org/web/20210425023830/https://www.sos.ok.gov/documents/executive/1992.pdf (previous order which was replaced by the order below)  https://web.archive.org/web/20210425030825/https://www.sos.ok.gov/documents/executive/1984.pdf (new order which makes no mention of any restrictions to residents or offices anymore),1,0,"A significant number of states have at least some restrictions still in place. However, North Carolina has lifted all event restrictions (including social distancing requirements) on May 14. Utah has no firm restrictions in place, only recommendations for events. New Jersey has lifted all event restrictions (other than enforcing social distancing) on indoor and outdoor events on June 4th. Hence, 1T is the correct coding.     https://web.archive.org/web/20210607215752/https://www.northstarmeetingsgroup.com/News/Industry/Coronavirus-states-cities-reopening-COVID-19-new-cases",4,0,Parts of California remain under a 10-people-indoors gathering restriction until at least June 15. 4 counties remain in such a tier as of June 08.    https://web.archive.org/web/20210607215752/https://www.northstarmeetingsgroup.com/News/Industry/Coronavirus-states-cities-reopening-COVID-19-new-cases  https://web.archive.org/web/20210607220356/https://covid19.ca.gov/safer-economy/,1,0,"Public transport in some parts of the country are operating without any restrictions. While ridership is lower than pre-pandemic, this is not the case because of restrictions but rather due to a higher share of telecommuters.     https://web.archive.org/web/20210607224109/https://apnews.com/article/coronavirus-government-and-politics-environment-and-nature-politics-lifestyle-56d36574e38cec038f77339ef12076bc    https://web.archive.org/web/20210607215752/https://www.northstarmeetingsgroup.com/News/Industry/Coronavirus-states-cities-reopening-COVID-19-new-cases#Oklahoma",1,0,"Though most states have ceased to give any blanket recommendations, at least the state of Massachussets continues to state the following in their COVID guidance: ""Even if you do not have symptoms, stay home as much as you can and practice social distancing if you must go out.""    https://web.archive.org/web/20210606135614/https://www.mass.gov/info-details/covid-19-prevention-and-treatment",1,0,"Most states have lifted any travel requirements or travel recommendations. However, Hawaii continues to restrict travel to the island and *to some islands within*: Gov. David Ige (D) issued a proclamation that will allow fully vaccinated travelers to bypass quarantine or testing requirements. Travelers will be required to upload valid documents to the state’s Safe Travel program or otherwise show validation. Alternatively, travelers arriving in Hawaii from out of state must either show a negative COVID-19 test result obtained within 72 hours pre-travel or self-quarantine for 10 days. Some islands require a second test, post-arrival. Visitors to Kauai must quarantine for 10 days, with or without a negative test result.    Kansas also continues to require quarantine for arrivals from certain states.     https://web.archive.org/web/20210607201653/https://www.aarp.org/politics-society/government-elections/info-2020/coronavirus-state-restrictions.html",3,NO FLAG,Travel limitations continue on certain countries.    https://web.archive.org/web/20210521125456/https://www.cdc.gov/coronavirus/2019-ncov/travelers/from-other-countries.html,1,1,Changed to 1 to reflect the fact that Pandemic Unemployment Assistance is only available for 13 weeks. Non-formal workers can apply.  https://web.archive.org/web/20210522091749/https://www.dol.gov/coronavirus/unemployment-insurance,1,NO FLAG,https://ncdoj.gov/covid19/economic-relief/,2,1,COVID-19 PUBLIC EDUCATION CAMPAIGN - https://web.archive.org/web/20210523001425/https://wecandothis.hhs.gov/,3,NO FLAG,"As per the CDC Testing guidelines, Test is generally available - https://web.archive.org/web/20210523001428/https://www.cdc.gov/coronavirus/2019-ncov/symptoms-testing/testing.html",1,NO FLAG,"Contact tracing is conducted on a statewide level, and is often further decentralized by county or local health departments or contracted out to private organizations. Not all states report their contact tracing statistics, so it is difficult to gauge the efficacy of contact tracing.     According to the CDC Covid-19 data dashboard, 8.25% of tests were positive over the past 7 days (as of April 14). As an example of contact tracing efforts, for the week of April 4, Oregon's contact tracers reached 84% of Covid-19 cases identified within a 24 hour period. Their goal is to reach 95% of cases. During the same timeframe, only 36.2% of positive cases were traced to a known source, and their goal is to trace at least 70% of cases to a known source.     Funds from the American Rescue Plan (signed into law March 11) are meant to provide technical assistance to states, municipalities, territories, and tribes to help trace and monitor the spread of Covid-19.     CDC: https://archive.vn/yvN69    Link to Plan text: https://web.archive.org/web/20210414214206/https://www.congress.gov/bill/117th-congress/house-bill/1319/text    Link to Oregon data: https://web.archive.org/web/20210414221835/https://public.tableau.com/profile/oregon.health.authority.covid.19",4,0,States like Nevada require masks to be worn at all times outside the house.    State by State Policies - https://web.archive.org/web/20210523000047/https://www.aarp.org/politics-society/government-elections/info-2020/coronavirus-state-restrictions.html,5,1,https://covid19.ncdhhs.gov/vaccines  https://web.archive.org/web/20210524014821/https://covid19.ncdhhs.gov/vaccines
Alaska,AK,Wed 23 Jun 2021,1,1,1,"Original note by Erin Kanzig: Beginning April 12, Juneau’s middle and high school students will be returning to school four days a week. The change expands the in-person high school schedule by one day and the middle school schedule by two days. Wednesday will remain a distance-learning day at all levels. Students can choose to continue with remote distance learning if they wish.     https://web.archive.org/web/20210407192221/https://www.juneauempire.com/news/school-district-announces-expansion-of-in-person-learning/    Coding updated by Reviewer Monika Pyarali to reflect previous changes (see note on March 15) ",1,0,"Anchorage's Emergency Order 19 remains in effect as of April 7. All restaurants, bars, breweries, and night clubs can open at reduced capacity to maintain physical distancing. Indoor entertainment facilities, indoor gyms and fitness centers can also operated with reduced capacity (masks required). Establishments offering sit-down service of any kind must have visitor logs in order to assist with contact tracing. Employers must require employees to work from home if remote work is feasible.    https://web.archive.org/web/20210407193145/https://www.muni.org/covid-19/documents/final%20signed%20eo19.pdf  ",1,0,Rachelle Koch (Reviewer) Edit:    Coded changed to 1T (from 2T) according to Attachments C and D of Anchorage Emergency Order 20 (enacted 17 April 2021). Attachment C allows for entertainment facilities to open at a capacity that allows for six feet of physical distancing and other COVID-19 related safety measures. Attachment D allows for organized sports with similar stipulations for spectators.    Anchorage EO-20 (enacted 17 April 2021):  https://web.archive.org/web/20210427202830/https://www.muni.org/covid-19/documents/emergencyorder20-final-signed.pdf  Attachment C on entertainment venues:  https://web.archive.org/web/20210427203849/https://www.muni.org/covid-19/documents/eo-20%20attachment%20c%20-%20entertainment%2041221.pdf  Attachment D on organized sports:  https://web.archive.org/web/20210414174904/https://www.muni.org/covid-19/documents/eo-20%20attachment%20d%20-%20organized%20sports%2041221%20230pm.pdf  ,3,0,"On April 17, Anchorage will lift all limits on outdoor gathering with mask and social distancing measure still in effect. Restrictions on indoor gathering (~35 people) will still be in place.    Source:  https://web.archive.org/web/20210414200618/https://apnews.com/article/alaska-anchorage-coronavirus-pandemic-2d11a1668c1c3bd6f0dc6dd9bf39975f    https://web.archive.org/web/20210412225928/https://www.adn.com/alaska-news/anchorage/2021/04/12/read-the-full-text-of-anchorages-emergency-order-lifting-outdoor-gathering-limitations/  ",0,0,"The People Mover in Anchorage continues to operate with safety measures in place, "" People Mover and AnchorRIDES continue to operate regular service and rider limits remain at 14-riders per 40-foot bus and 6-riders per vehicle on the neighborhood routes with 22-foot buses. Cloth face coverings are still required to ride People Mover.""     https://archive.vn/II4oD",1,0,"Anchorage's EO-19 encourages people to avoid contact with those outside their household and to limit trips outside the home.    Health Advisory No. 1 also remains in effect statewide (""Minimize time indoors with individuals outside your household even if you can maintain a distance of six feet. Avoid all gatherings, even small ones, with persons who are not in your household."")     https://web.archive.org/web/20210407194808/https://covid19.alaska.gov/wp-content/uploads/2021/02/02.14.21-Health-Advisory-1-Recommendations.pdf    https://web.archive.org/web/20210407193145/https://www.muni.org/covid-19/documents/final%20signed%20eo19.pdf  ",1,1,"According to Health Advisory 2, the State do not restrict or limit any internal movement in Alaska. While general recommendation against against traveling for those tested COVID positive still in place.     Source:  https://web.archive.org/web/20210603193248/https://covid19.alaska.gov/wp-content/uploads/2021/04/04.26.21-Health-Advisory-3-Intrastate-Travel.pdf  ",3,NO FLAG,"No new updates. Policy last updated 30 April 2021.    The CDC states:   ""With specific exceptions, several Presidential proclamations suspend and limit entry into the United States, as immigrants or nonimmigrants, of noncitizens who were physically present within the following countries during the 14-day period preceding their entry or attempted entry into the United States."" This includes fully vaccinated people. See webpage for list of countries.    https://web.archive.org/web/20210618023101/https://www.cdc.gov/coronavirus/2019-ncov/travelers/from-other-countries.html",1,0,Unemployment assistance is available. The Division of Public Assistance lists other resources available to Alaskans on their website.     https://web.archive.org/web/20210410211043/https://labor.alaska.gov/COVID-19-programs.htm    https://web.archive.org/web/20210410211545/https://cse.google.com/cse.js?cx=c0fe050eb6ce15f1d,1,NO FLAG,"There are no active statewide moratoriums or suspensions of utility shutoffs. The CDC eviction moratorium is in effect. Those who qualified for the rental assistance program (applications closed March 5) will have access to 12 months of rental assistance.     https://web.archive.org/web/20210410211545/https://cse.google.com/cse.js?cx=c0fe050eb6ce15f1d    https://web.archive.org/web/20210410213801/https://www.muni.org/Departments/Mayor/PressReleases/Pages/Municipality-of-Anchorage,-Cook-Inlet-Housing-Authority-partner-with-Alaska-Housing-to-distribute-up-to-12-months-of-rent-a.aspx",2,1,"The public continues to be informed about Covid-19, vaccination and testing, etc. As an example:     https://web.archive.org/web/20210410215810/https://public.govdelivery.com/assets/Signup.js",3,NO FLAG,COVID-19 testing is widely available to the public.   https://web.archive.org/web/20210410220041/https://coronavirus-response-alaska-dhss.hub.arcgis.com/app/2d92b77bc8044329a1ee3954b063bd8c,1,NO FLAG,"Alaska has a contact tracing program, though it is not clear how thorough it is.    https://web.archive.org/web/20210322232305/https://cse.google.com/cse.js?cx=c0fe050eb6ce15f1d",3,0,Anchorage Assembly ends mask mandate effective immediately marking a significant policy change on mask mandate termination that was originally scheduled on May 21.  Currently (May 14 Update) over 37% and 42% of Alaskans are vaccinated fully and with at least one dose respectively.    Source:  https://web.archive.org/web/20210515150017/https://www.adn.com/alaska-news/anchorage/2021/05/14/anchorage-assembly-ends-mask-mandate-effective-immediately/,5,1,"Alaska begins Free Vaccination Campaign at three major airport for anyone traveling to Alaska for business, tourism, and other purpose.    Source:   https://web.archive.org/web/20210603194748/https://www.alaskapublic.org/2021/06/02/alaska-launches-covid-19-airport-vaccination-program/  https://web.archive.org/web/20210603194856/https://www.npr.org/2021/06/02/1002710403/alaska-lures-tourists-with-its-stunning-landscapes-and-free-covid-19-vaccine"
Alabama,AL,Wed 23 Jun 2021,1,0,1,"As of 1 June, begin to code as 0 since the Safer Apart order is no longer in effect.    https://web.archive.org/web/20210604194908/https://governor.alabama.gov/newsroom/2021/05/governor-ivey-announces-covid-19-public-health-order-and-state-of-emergency-to-end/",1,1,"Policy last updated June 14, 2021 to include information on fully vaccinated people, which resulted in NO change to the policy.    The CDC recommendations include risk mitigation but does not recommend closures. The ""Guidance for Businesses and Employers Responding to Coronavirus Disease 2019 (COVID-19)"" was last updated on 31 December 2020 and also doesn't recommend closures.     https://web.archive.org/web/20210615113611/https://www.cdc.gov/coronavirus/2019-ncov/community/organizations/business-employers/bars-restaurants.html    https://web.archive.org/web/20210621171029/https://www.cdc.gov/coronavirus/2019-ncov/community/guidance-business-response.html",1,1,"No new updates. Policy last updated 20 May 2021: ""Updated cleaning and disinfection information""    The CDC ""continues to recommend avoiding large events and gatherings. Currently, CDC does not provide numbers to define small and large events.""    https://web.archive.org/web/20210620185116/https://www.cdc.gov/coronavirus/2019-ncov/community/large-events/considerations-for-events-gatherings.html",0,1,"Continue to code as 0. As of 1 June 2021, the Safer Apart order is no longer in effect.    https://web.archive.org/web/20210604194908/https://governor.alabama.gov/newsroom/2021/05/governor-ivey-announces-covid-19-public-health-order-and-state-of-emergency-to-end/",0,0,No change in policy found.,0,1,No change in policy found.,1,1,"The CDC states: ""Delay travel until you are fully vaccinated. If you are not fully vaccinated and must travel, follow CDC’s recommendations for unvaccinated people. . . . You do NOT need to get tested or self-quarantine if you are fully vaccinated or have recovered from COVID-19 in the past 3 months. You should still follow all other travel recommendations.""     On 10 June 2021, the CDC updated domestic travel recommendations with the changes in mask guidance for vaccinated vs unvaccinated people:     ""Wearing a mask over your nose and mouth is required on planes, buses, trains, and other forms of public transportation traveling into, within, or out of the United States and while indoors at U.S. transportation hubs such as airports and stations. Travelers are not required to wear a mask in outdoor areas of a conveyance (like on a ferry or the top deck of a bus). CDC recommends that travelers who are not fully vaccinated continue to wear a mask and maintain physical distance when traveling.""    https://web.archive.org/web/20210618031941/https://www.cdc.gov/coronavirus/2019-ncov/travelers/travel-during-covid19.html",3,NO FLAG,"No new updates. Policy last updated 30 April 2021.    The CDC states:   ""With specific exceptions, several Presidential proclamations suspend and limit entry into the United States, as immigrants or nonimmigrants, of noncitizens who were physically present within the following countries during the 14-day period preceding their entry or attempted entry into the United States."" This includes fully vaccinated people. See webpage for list of countries.    https://web.archive.org/web/20210618023101/https://www.cdc.gov/coronavirus/2019-ncov/travelers/from-other-countries.html",1,1,"No change in policy as of 12 June 2021 so continue to code as 1A.    However, “Alabama will end its participation in all federally funded pandemic unemployment compensation programs effective June 19 including: the additional $300 weekly payment to recipients of unemployment compensation; benefits to gig and part-time workers who would not usually qualify; and an emergency extension of benefits.”    https://web.archive.org/web/20210611012917/https://apnews.com/article/sc-state-wire-alabama-coronavirus-pandemic-business-health-aeb664db9ad9d1d414953afd4c6f3cf5",1,NO FLAG,"On 29 March 2021, the CDC announced a 90 day extension of the federal eviction moratorium. The moratorium is effective 01 April 2021 through 30 June 2021.    The Biden Administration's American Rescue Plan does not provide any other form of explicit contract relief, so the code remains 1.    Link to CDC Eviction Moratorium:  https://web.archive.org/web/20210329145921/https://www.cdc.gov/coronavirus/2019-ncov/more/pdf/CDC-Eviction-Moratorium-03292021.pdf    Link to White House Press Release on continued renter and landlord support:  https://web.archive.org/web/20210329145608/https://www.whitehouse.gov/briefing-room/statements-releases/2021/03/29/fact-sheet-the-biden-harris-administrations-multi-agency-effort-to-support-renters-and-landlords/",2,1,"No change in policy as of 11 June 2021 so continue to code as 2G. Among other things, there continues to be a frequently updated website with COVID-related information.    https://web.archive.org/web/20210611013721/https://covid19.alabama.gov/",2,NO FLAG,"As of 04 May 2021, CDC recommends testing for those who have COVID-19 symptoms and those who are asymptomatic with certain criteria. Because not all asymptomatic people should be tested (see below), I am keeping the code at 2 (open to revision).    ""The following people should get tested for COVID-19:    People who have symptoms of COVID-19.  People who are fully vaccinated with COVID-19 vaccine should be evaluated by their healthcare provider and tested for COVID-19 if indicated.  People without symptoms of COVID-19 such as:  People not fully vaccinated with COVID-19 vaccine who have had close contact with someone with confirmed COVID-19 (including a person who does not have symptoms within 10 days of their positive test result).  People not fully vaccinated with COVID-19 vaccine who have taken part in activities that put them at higher risk for COVID-19, such as attending large social or mass gatherings, or being in crowded indoor settings.  People not fully vaccinated with COVID-19 vaccine who are prioritized for expanded community screening for COVID-19.  People not fully vaccinated with COVID-19 vaccine who have been asked or referred to get testing by their school, workplace, healthcare provider, state, tribal, local or territorial health department.    The following people who have been exposed to someone with COVID-19 do NOT need to get tested if they do not have COVID-19 symptoms:    Persons who are fully vaccinated with COVID-19 vaccine not living in a congregate setting.  For residents in non-healthcare congregate settings (e.g. correctional and detention facilities, group homes) and employees of residential congregate settings and high-density workplaces (e.g. meat and poultry processing and manufacturing plants), refer to CDC’s recommendations for fully vaccinated people.  People who have tested positive for COVID-19 within the past 3 months and recovered, as long as they do not develop new symptoms, do not need to get tested.""    https://web.archive.org/web/20210614184511/https://www.cdc.gov/coronavirus/2019-ncov/testing/diagnostic-testing.html",1,NO FLAG,No change in policy as of 12 June 2021 so continue to code as 1.    https://web.archive.org/web/20210604214204/https://www.alabamapublichealth.gov/covid19/contact-tracing.html,2,1,"No new updates. Policy last updated 16 May 2021. ""If you are fully vaccinated, you can resume activities that you did prior to the pandemic. Fully vaccinated people can resume activities without wearing a mask or physically distancing, except where required by federal, state, local, tribal, or territorial laws, rules, and regulations, including local business and workplace guidance.""    https://web.archive.org/web/20210612011626/https://www.cdc.gov/coronavirus/2019-ncov/vaccines/fully-vaccinated.html",5,1,No change in policy as of 12 June 2021 so continue to code as 5G.    https://web.archive.org/web/20210605002212/https://www.alabamapublichealth.gov/covid19vaccine/
